index,time_range,text
707,"00:29:34,440 --> 00:29:38,600",and you have to stream in prediction
708,"00:29:36,679 --> 00:29:40,880",over a super large
709,"00:29:38,600 --> 00:29:42,640",database maybe you want to worry of that
710,"00:29:40,880 --> 00:29:45,880",about that a bit but for many
711,"00:29:42,640 --> 00:29:47,399",applications this is not an issue okay I
712,"00:29:45,880 --> 00:29:49,360",hope this session was not too long and
713,"00:29:47,399 --> 00:29:51,159",you could still uh follow along nicely
714,"00:29:49,360 --> 00:29:53,080",this concludes our session on the random
715,"00:29:51,159 --> 00:29:55,440",Forest algorithm here see you in the
