index,time_range,text
1,"00:00:00,160 --> 00:00:05,480",hi Welcome to our next session here in
2,"00:00:02,879 --> 00:00:07,439",our yeah chapter on the random Forest
3,"00:00:05,480 --> 00:00:10,599",algorithm where in this session here I
4,"00:00:07,439 --> 00:00:12,920",will now truly introduce and discuss the
5,"00:00:10,599 --> 00:00:16,080",fundamentals of the random Forest
6,"00:00:12,920 --> 00:00:18,600",algorithm okay we'll understand how this
7,"00:00:16,080 --> 00:00:20,800",extends the idea of bagging we'll then
8,"00:00:18,600 --> 00:00:23,359",spend some time to understand the
9,"00:00:20,800 --> 00:00:26,560",general idea behind the decorrelation of
10,"00:00:23,359 --> 00:00:29,679",trees so the feature subsampling in the
11,"00:00:26,560 --> 00:00:31,519",ren Forest algorithm we'll discuss the
12,"00:00:29,679 --> 00:00:34,320",effect
13,"00:00:31,519 --> 00:00:36,320",of yeah um the I would say the most
14,"00:00:34,320 --> 00:00:39,200",important hyper parames of the random
15,"00:00:36,320 --> 00:00:41,079",Forest algorithm and then discuss
16,"00:00:39,200 --> 00:00:43,000",whether random Forest can actually
17,"00:00:41,079 --> 00:00:44,760",overfit answer little bit of
18,"00:00:43,000 --> 00:00:47,600",foreshadowing yes they
19,"00:00:44,760 --> 00:00:50,120",can Okay so let's start we have
20,"00:00:47,600 --> 00:00:51,760",discussed the card algorithm before so
21,"00:00:50,120 --> 00:00:54,239",classification and regression trees by
22,"00:00:51,760 --> 00:00:56,079",bran that actually has quite a few
23,"00:00:54,239 --> 00:00:58,120",appealing features it's quite
24,"00:00:56,079 --> 00:01:00,320",interoperable so it's easy to understand
25,"00:00:58,120 --> 00:01:03,359",it's easy to explain because it's a
26,"00:01:00,320 --> 00:01:06,040",simple decision tree it is invariant
27,"00:01:03,359 --> 00:01:09,240",under rank preserving Transformations so
28,"00:01:06,040 --> 00:01:11,759",as long as we keep yeah the order of
29,"00:01:09,240 --> 00:01:15,000",feature values fixed while we transform
30,"00:01:11,759 --> 00:01:17,920",them so by shifting them scaling them or
31,"00:01:15,000 --> 00:01:20,479",doing any other type of monotonous
32,"00:01:17,920 --> 00:01:23,200",transformation the the resulting model
33,"00:01:20,479 --> 00:01:24,960",the resulting decision tree will not be
34,"00:01:23,200 --> 00:01:27,079",substantially influenced by this the
35,"00:01:24,960 --> 00:01:28,439",location of the split points will vary
36,"00:01:27,079 --> 00:01:30,640",but we're basically fitting the same
37,"00:01:28,439 --> 00:01:32,960",type the same type of model model and
38,"00:01:30,640 --> 00:01:35,159",particularly the a model with the same
39,"00:01:32,960 --> 00:01:38,280",predictive power and
40,"00:01:35,159 --> 00:01:40,399",performance trees can work with cacor
41,"00:01:38,280 --> 00:01:42,240",categorical features as they can with
42,"00:01:40,399 --> 00:01:45,360",numerical features and they even can
43,"00:01:42,240 --> 00:01:49,280",work with data where there are missing
44,"00:01:45,360 --> 00:01:52,880",values present in the features Yeah by
45,"00:01:49,280 --> 00:01:54,680",using so-called surrogate splits now
46,"00:01:52,880 --> 00:01:57,600",here's a quote from hasted tipani and
47,"00:01:54,680 --> 00:02:00,399",Freedman which says trees have exactly
48,"00:01:57,600 --> 00:02:02,320",only one aspect that prevents them from
49,"00:02:00,399 --> 00:02:05,039",being an Ideal tool for predictive
50,"00:02:02,320 --> 00:02:06,920",learning not sure whether we go that far
51,"00:02:05,039 --> 00:02:09,160",but they say h they could be a bit more
52,"00:02:06,920 --> 00:02:11,520",accurate yeah they're not the most
53,"00:02:09,160 --> 00:02:14,040",powerful predictor the idea of the
54,"00:02:11,520 --> 00:02:16,840",random Forest is to basically attack
55,"00:02:14,040 --> 00:02:19,879",exactly that problem by creating a
56,"00:02:16,840 --> 00:02:21,760",begging Ensemble on top of decision
57,"00:02:19,879 --> 00:02:23,560",trees we'll see that I guess this will
58,"00:02:21,760 --> 00:02:28,720",become somewhat obvious that we'll lose
59,"00:02:23,560 --> 00:02:30,640",the inability aspect of the single tree
60,"00:02:28,720 --> 00:02:33,599",but all of these other
61,"00:02:30,640 --> 00:02:36,080",advantages of the card algorithm that
62,"00:02:33,599 --> 00:02:39,000",inherited into the random forest and we
63,"00:02:36,080 --> 00:02:41,760",will also create a usually a way
64,"00:02:39,000 --> 00:02:44,760",stronger predictor by embling in
65,"00:02:41,760 --> 00:02:48,120",comparison to using a single decision
66,"00:02:44,760 --> 00:02:50,920",tree so how does this work now we create
67,"00:02:48,120 --> 00:02:52,720",a begging Ensemble out of a bunch of
68,"00:02:50,920 --> 00:02:54,239",decision trees we have discussed how
69,"00:02:52,720 --> 00:02:56,440",that works right so I don't have to
70,"00:02:54,239 --> 00:02:59,040",repeat this year again bman when he
71,"00:02:56,440 --> 00:03:01,480",introduced that which I think was around
72,"00:02:59,040 --> 00:03:04,000",1998 eight he thought about this a
73,"00:03:01,480 --> 00:03:05,799",little bit more more deeply and he
74,"00:03:04,000 --> 00:03:08,560",wanted to figure out whether he can
75,"00:03:05,799 --> 00:03:11,560",could even improve the predictive
76,"00:03:08,560 --> 00:03:13,959",performance of such a begging Ensemble
77,"00:03:11,560 --> 00:03:17,120",further and then he figured out that the
78,"00:03:13,959 --> 00:03:19,480",correlation among the emble members
79,"00:03:17,120 --> 00:03:21,400",might actually be a problem or that to
80,"00:03:19,480 --> 00:03:23,840",State it more positively That by
81,"00:03:21,400 --> 00:03:25,599",decorrelating The Ensemble members he
82,"00:03:23,840 --> 00:03:28,519",could he could potentially improve
83,"00:03:25,599 --> 00:03:30,959",productive performance and we'll discuss
84,"00:03:28,519 --> 00:03:34,200",exactly that now here's some intuition
85,"00:03:30,959 --> 00:03:37,959",behind that how does bagging how does
86,"00:03:34,200 --> 00:03:41,040",bagging work we have our model fad and
87,"00:03:37,959 --> 00:03:44,599",our model f hat is going to be a simple
88,"00:03:41,040 --> 00:03:46,599",average across capital M base Learners
89,"00:03:44,599 --> 00:03:49,879",we already know we at least have a
90,"00:03:46,599 --> 00:03:54,000",little bit of intuition that in yeah in
91,"00:03:49,879 --> 00:03:56,560",terms of prediction error the variance
92,"00:03:54,000 --> 00:03:58,040",of such a model and that the variance
93,"00:03:56,560 --> 00:04:00,400",here of our assemble because that's what
94,"00:03:58,040 --> 00:04:03,040",we care about is made
95,"00:04:00,400 --> 00:04:05,480",yeah yeah not the best thing so if the
96,"00:04:03,040 --> 00:04:08,120",model is very unstable if it's very if
97,"00:04:05,480 --> 00:04:11,720",it has a has a large variance that's
98,"00:04:08,120 --> 00:04:13,720",usually also a that's a component in our
99,"00:04:11,720 --> 00:04:15,919",generalization error in this case we
100,"00:04:13,720 --> 00:04:18,160",actually like the variance of the
101,"00:04:15,919 --> 00:04:20,079",underlying base learning algorithm
102,"00:04:18,160 --> 00:04:22,800",because that's something we can now
103,"00:04:20,079 --> 00:04:27,320",smooth out over and that we can attack
104,"00:04:22,800 --> 00:04:29,720",and reduce but the variance of our
105,"00:04:27,320 --> 00:04:31,560",resulting Ensemble that should be
106,"00:04:29,720 --> 00:04:33,199",reasonably small if that's too high
107,"00:04:31,560 --> 00:04:36,240",that's usually large component also in
108,"00:04:33,199 --> 00:04:38,680",our generalization error now do we also
109,"00:04:36,240 --> 00:04:41,919",have an intuition how variance goes down
110,"00:04:38,680 --> 00:04:44,440",if we yeah look at some some fundamental
111,"00:04:41,919 --> 00:04:47,320",theorems of probability Theory or
112,"00:04:44,440 --> 00:04:50,600",statistics we can expect that variance
113,"00:04:47,320 --> 00:04:52,960",goes down linearly if we average out
114,"00:04:50,600 --> 00:04:54,919",over capital M random
115,"00:04:52,960 --> 00:04:56,840",variables if they are
116,"00:04:54,919 --> 00:04:58,800",independent okay if things are
117,"00:04:56,840 --> 00:05:01,560",independent let's say they are IID
118,"00:04:58,800 --> 00:05:04,479",distributed we compute their average and
119,"00:05:01,560 --> 00:05:07,840",then we look at the variance of the
120,"00:05:04,479 --> 00:05:10,400",average in comparison to the average of
121,"00:05:07,840 --> 00:05:12,880",one single random variable variance goes
122,"00:05:10,400 --> 00:05:12,880",down
123,"00:05:13,039 --> 00:05:21,240",linearly now can we
124,"00:05:16,160 --> 00:05:23,680",expect our Ensemble members here in our
125,"00:05:21,240 --> 00:05:26,039",begging Ensemble to be independent
126,"00:05:23,680 --> 00:05:28,800",likely wrong right can't really expect
127,"00:05:26,039 --> 00:05:31,240",that because our individual Ensemble
128,"00:05:28,800 --> 00:05:33,880",members me numbers will be correlated
129,"00:05:31,240 --> 00:05:36,639",and this is because our bootstrap
130,"00:05:33,880 --> 00:05:39,840",samples are um fairly similar right we
131,"00:05:36,639 --> 00:05:42,199",are sampling from the same underlying um
132,"00:05:39,840 --> 00:05:45,840",training data set the bootstrap datas
133,"00:05:42,199 --> 00:05:48,720",are um yeah fairly similar and this will
134,"00:05:45,840 --> 00:05:50,680",also make our resulting models somewhat
135,"00:05:48,720 --> 00:05:54,560",similar and
136,"00:05:50,680 --> 00:05:58,840",correlated now if that's the case how
137,"00:05:54,560 --> 00:06:01,840",about then we do um yeah more uh deeper
138,"00:05:58,840 --> 00:06:04,880",analysis of what the variance of our
139,"00:06:01,840 --> 00:06:07,160",resulting model actually is okay let's
140,"00:06:04,880 --> 00:06:09,680",let's do exactly that so just assume two
141,"00:06:07,160 --> 00:06:12,440",things so this analysis here is a little
142,"00:06:09,680 --> 00:06:15,199",bit simplified but I guess it's going to
143,"00:06:12,440 --> 00:06:16,440",be instructive anyway so I'll assume
144,"00:06:15,199 --> 00:06:18,319",that yeah and this is where I'm
145,"00:06:16,440 --> 00:06:20,639",simplifying things a little bit so this
146,"00:06:18,319 --> 00:06:23,000",here is of course a function these these
147,"00:06:20,639 --> 00:06:24,759",base Learners kind of treat them here as
148,"00:06:23,000 --> 00:06:27,880",a scalar random
149,"00:06:24,759 --> 00:06:32,319",variable and I'm assuming they have all
150,"00:06:27,880 --> 00:06:35,560",the same variance Sigma squ and I'm also
151,"00:06:32,319 --> 00:06:38,039",assuming they have a fixed correlation
152,"00:06:35,560 --> 00:06:41,479",between any yeah any two of them and
153,"00:06:38,039 --> 00:06:43,919",that correlation all denote by row what
154,"00:06:41,479 --> 00:06:46,400",is now the variance of our Ensemble fad
155,"00:06:43,919 --> 00:06:48,639",we just insert our definition of the
156,"00:06:46,400 --> 00:06:53,120",bagging Ensemble that's just an average
157,"00:06:48,639 --> 00:06:55,240",yeah over these base Learners bad n now
158,"00:06:53,120 --> 00:06:58,440",there is now a nice formula for what
159,"00:06:55,240 --> 00:07:00,080",happens with the variance even if stuff
160,"00:06:58,440 --> 00:07:01,680",is not completely independ depent if it
161,"00:07:00,080 --> 00:07:04,680",would be independent I could now just
162,"00:07:01,680 --> 00:07:06,800",draw the variance operator kind of in a
163,"00:07:04,680 --> 00:07:08,440",in a linear fashion inside of the sum
164,"00:07:06,800 --> 00:07:10,759",but here I can't do that because stuff
165,"00:07:08,440 --> 00:07:13,199",is correlated but I can use this more
166,"00:07:10,759 --> 00:07:14,280",general formula here we have this which
167,"00:07:13,199 --> 00:07:17,080",in a certain sense looks a little bit
168,"00:07:14,280 --> 00:07:19,360",like a binomial formula so these squar
169,"00:07:17,080 --> 00:07:23,000",terms here but here I have these
170,"00:07:19,360 --> 00:07:25,400",covariance terms between Pairs of random
171,"00:07:23,000 --> 00:07:26,879",variables okay can write it like that
172,"00:07:25,400 --> 00:07:29,639",and now the only thing I will do is I
173,"00:07:26,879 --> 00:07:33,160",will insert my my constants my
174,"00:07:29,639 --> 00:07:35,360",abbreviations so the variance of bad M
175,"00:07:33,160 --> 00:07:37,800",so that's supposed to be Sigma squ so
176,"00:07:35,360 --> 00:07:40,520",we'll insert that here and now there's a
177,"00:07:37,800 --> 00:07:44,720",sum over M of these things so it's
178,"00:07:40,520 --> 00:07:47,120",capital M of Sigma squ I can also insert
179,"00:07:44,720 --> 00:07:48,680",my correlation here now I have to be a
180,"00:07:47,120 --> 00:07:51,440",little bit careful because correlation
181,"00:07:48,680 --> 00:07:54,039",is not the same as Co variance but
182,"00:07:51,440 --> 00:07:56,639",correlation multiplied by the standard
183,"00:07:54,039 --> 00:07:58,000",deviation of of the one variable
184,"00:07:56,639 --> 00:08:00,159",multipli by the standard deviation of
185,"00:07:58,000 --> 00:08:01,639",the other variable that's the same as Co
186,"00:08:00,159 --> 00:08:03,919",variance and because they all have the
187,"00:08:01,639 --> 00:08:08,759",same variance so it's co variance
188,"00:08:03,919 --> 00:08:12,440",between I and J is or sorry M and J is
189,"00:08:08,759 --> 00:08:14,879",simply row * Sigma * Sigma so * Sigma
190,"00:08:12,440 --> 00:08:18,960",squ now all of these terms here in this
191,"00:08:14,879 --> 00:08:23,319",sum they are now all also all the same
192,"00:08:18,960 --> 00:08:29,199",it's a sum over let me check capital M
193,"00:08:23,319 --> 00:08:32,959",over 2 PA so this is M * m - 1 / 2 we
194,"00:08:29,199 --> 00:08:35,440",cop over the two oh and I forgot about
195,"00:08:32,959 --> 00:08:37,479",this guy here so the one divided by m
196,"00:08:35,440 --> 00:08:39,839",that's inside of the variant so we draw
197,"00:08:37,479 --> 00:08:43,800",that to the outside I'm actually already
198,"00:08:39,839 --> 00:08:46,080",doing that here this becomes 1 / m^2 and
199,"00:08:43,800 --> 00:08:49,160",now you just simplify things a little
200,"00:08:46,080 --> 00:08:51,519",bit you collect terms a bit I'll remove
201,"00:08:49,160 --> 00:08:53,480",all of my annoying scribbling here and
202,"00:08:51,519 --> 00:08:55,519",then we look at the resulting formula
203,"00:08:53,480 --> 00:08:57,880",and that has actually pretty nice
204,"00:08:55,519 --> 00:09:02,680",structure it's quite instructive so we
205,"00:08:57,880 --> 00:09:05,600",can see here the sigma squ ided by m so
206,"00:09:02,680 --> 00:09:07,800",that would be the optimal reduction in
207,"00:09:05,600 --> 00:09:11,040",variance we could ever hope for okay if
208,"00:09:07,800 --> 00:09:14,200",there would be no correlation and here
209,"00:09:11,040 --> 00:09:15,880",the sigma squar that's the worst that
210,"00:09:14,200 --> 00:09:19,000",can happen to
211,"00:09:15,880 --> 00:09:21,120",us because that would be no reduction
212,"00:09:19,000 --> 00:09:24,519",variance you could for example think of
213,"00:09:21,120 --> 00:09:26,040",all models being exact copies of each
214,"00:09:24,519 --> 00:09:28,040",other yeah so really deterministic
215,"00:09:26,040 --> 00:09:29,519",copies then if you average those there
216,"00:09:28,040 --> 00:09:31,760",will be no reduction variance right
217,"00:09:29,519 --> 00:09:35,320",because you're just aing out averaging
218,"00:09:31,760 --> 00:09:38,440",out over all of the same things now this
219,"00:09:35,320 --> 00:09:42,240",formula here tells us that between this
220,"00:09:38,440 --> 00:09:45,839",zero reduction in variance and between
221,"00:09:42,240 --> 00:09:48,320",this optimal linear reduction in
222,"00:09:45,839 --> 00:09:49,920",invariance what we get is a convex
223,"00:09:48,320 --> 00:09:51,959",combination of the two so you can see
224,"00:09:49,920 --> 00:09:55,240",the convex combination here by one minus
225,"00:09:51,959 --> 00:09:57,680",row here and having the RO there and
226,"00:09:55,240 --> 00:10:00,600",this convex combination is controlled by
227,"00:09:57,680 --> 00:10:02,959",the correlation between test of models
228,"00:10:00,600 --> 00:10:06,079",of random variables the stronger the
229,"00:10:02,959 --> 00:10:08,839",correlation the less reduction you get
230,"00:10:06,079 --> 00:10:12,160",the closer you are to this yeah to this
231,"00:10:08,839 --> 00:10:16,360",zero reduction in variance and if so if
232,"00:10:12,160 --> 00:10:19,000",for example yeah if if robot be one yeah
233,"00:10:16,360 --> 00:10:22,040",then this here becomes zero and we just
234,"00:10:19,000 --> 00:10:25,279",end up with this very bad scenario where
235,"00:10:22,040 --> 00:10:27,959",there's no reduction and if R would be
236,"00:10:25,279 --> 00:10:30,279",zero there would be no correlation yeah
237,"00:10:27,959 --> 00:10:31,600",then we have in this scenario of
238,"00:10:30,279 --> 00:10:33,000",shouldn't say independence because we
239,"00:10:31,600 --> 00:10:34,680",don't know that whether things are
240,"00:10:33,000 --> 00:10:36,639",normally distributed here but in this
241,"00:10:34,680 --> 00:10:37,839",uncorrelated scenario where we get
242,"00:10:36,639 --> 00:10:40,399",linear
243,"00:10:37,839 --> 00:10:42,800",reduction this is somewhat simplified
244,"00:10:40,399 --> 00:10:45,279",I'll add a caveat on the next slide but
245,"00:10:42,800 --> 00:10:48,480",in general now the idea is can we maybe
246,"00:10:45,279 --> 00:10:51,240",decorrelate trees bit more to reduce
247,"00:10:48,480 --> 00:10:53,920",onal variance and that will maybe also
248,"00:10:51,240 --> 00:10:57,440",help us to reduce production error I
249,"00:10:53,920 --> 00:10:59,800",guess that is a valid path forward now
250,"00:10:57,440 --> 00:11:02,839",and this is exactly what bman did so he
251,"00:10:59,800 --> 00:11:04,800",now thought about a simple randomization
252,"00:11:02,839 --> 00:11:07,399",procedure that he could bring into the
253,"00:11:04,800 --> 00:11:09,240",tree fitting algorithm so what we are
254,"00:11:07,399 --> 00:11:12,760",now doing is when we are fitting our
255,"00:11:09,240 --> 00:11:14,639",tree we greedily construct more and more
256,"00:11:12,760 --> 00:11:17,639",nodes in the tree we construct more and
257,"00:11:14,639 --> 00:11:19,720",more splits and in each individual split
258,"00:11:17,639 --> 00:11:21,440",and when we construct that we search for
259,"00:11:19,720 --> 00:11:23,680",the best split and when we search for
260,"00:11:21,440 --> 00:11:26,120",the best split we search over all
261,"00:11:23,680 --> 00:11:28,839",potential features and then over all
262,"00:11:26,120 --> 00:11:31,360",possible split points to find the one
263,"00:11:28,839 --> 00:11:34,240",which would reduces our risk the most so
264,"00:11:31,360 --> 00:11:38,399",this randomization procedure now says do
265,"00:11:34,240 --> 00:11:41,200",not search over all features but only
266,"00:11:38,399 --> 00:11:43,440",consider a certain subset and that
267,"00:11:41,200 --> 00:11:45,120",random subset of the I don't know
268,"00:11:43,440 --> 00:11:47,959",feasible features you're allowed to look
269,"00:11:45,120 --> 00:11:50,920",at in Split finding that's randomly
270,"00:11:47,959 --> 00:11:53,279",sampled again and again um per note you
271,"00:11:50,920 --> 00:11:55,880",could do this also per tree but usually
272,"00:11:53,279 --> 00:11:58,200",this is done on a per note basis if you
273,"00:11:55,880 --> 00:12:00,480",look in some at some implementations
274,"00:11:58,200 --> 00:12:03,360",especially in r this parameter is called
275,"00:12:00,480 --> 00:12:05,720",M try I guess that might be for maximum
276,"00:12:03,360 --> 00:12:08,320",number of features to try out for
277,"00:12:05,720 --> 00:12:10,200",finding a split I'm not exactly sure
278,"00:12:08,320 --> 00:12:12,519",whether that's the the interpretation of
279,"00:12:10,200 --> 00:12:14,360",the m and we will only consider these
280,"00:12:12,519 --> 00:12:16,600",features now for finding the best split
281,"00:12:14,360 --> 00:12:19,839",so maybe here this is our complete let
282,"00:12:16,600 --> 00:12:21,360",me actually switch my pen tool on again
283,"00:12:19,839 --> 00:12:23,480",so that maybe that's our complete data
284,"00:12:21,360 --> 00:12:24,920",set here so with our Target column here
285,"00:12:23,480 --> 00:12:27,040",we might have a bunch of different
286,"00:12:24,920 --> 00:12:29,399",features maybe there's four but now we
287,"00:12:27,040 --> 00:12:31,600",will only allow color and length yeah
288,"00:12:29,399 --> 00:12:34,360",for this I don't know um training data
289,"00:12:31,600 --> 00:12:36,519",set of measurements of bananas or
290,"00:12:34,360 --> 00:12:39,199",objects which can be bananas and maybe
291,"00:12:36,519 --> 00:12:42,920",also something else and we will not only
292,"00:12:39,199 --> 00:12:44,680",search over them okay um and the idea is
293,"00:12:42,920 --> 00:12:47,519",I guess that's some pretty obvious so
294,"00:12:44,680 --> 00:12:50,000",the more we decorrelate or we the
295,"00:12:47,519 --> 00:12:52,720",smaller we set this mry here the more
296,"00:12:50,000 --> 00:12:55,440",trees become decorrelated but also the
297,"00:12:52,720 --> 00:12:58,120",more rendom our trees become in the
298,"00:12:55,440 --> 00:13:00,279",extreme case for example for a specific
299,"00:12:58,120 --> 00:13:03,279",node and you you might have a large
300,"00:13:00,279 --> 00:13:05,760",number of features maybe 100 and M2
301,"00:13:03,279 --> 00:13:07,639",would be set to one so you now pick one
302,"00:13:05,760 --> 00:13:09,480",random feature and then you only allowed
303,"00:13:07,639 --> 00:13:11,199",to search for the best split point for
304,"00:13:09,480 --> 00:13:12,480",that feature which might be a very bad
305,"00:13:11,199 --> 00:13:14,120",one yeah it might not carry any
306,"00:13:12,480 --> 00:13:15,959",information it might not even be
307,"00:13:14,120 --> 00:13:18,240",associated with wi might be some
308,"00:13:15,959 --> 00:13:20,560",something like a noise feature but so
309,"00:13:18,240 --> 00:13:22,920",you but you're only allowed to use that
310,"00:13:20,560 --> 00:13:25,360",to find a split at that note guess for a
311,"00:13:22,920 --> 00:13:27,440",newe going to sample again but this
312,"00:13:25,360 --> 00:13:29,120",makes the trees fairly random and this
313,"00:13:27,440 --> 00:13:31,240",will also have a negative effect if you
314,"00:13:29,120 --> 00:13:33,040",overdo that but hopefully there might be
315,"00:13:31,240 --> 00:13:35,959",something like a sweet sweet spot in the
316,"00:13:33,040 --> 00:13:38,600",Middle where this decorrelation helps to
317,"00:13:35,959 --> 00:13:40,680",reduce variance as we discussed before
318,"00:13:38,600 --> 00:13:43,160",but the trees are not becoming super
319,"00:13:40,680 --> 00:13:46,320",random and this is usually exactly what
320,"00:13:43,160 --> 00:13:49,720",happens I've created here to simp yeah
321,"00:13:46,320 --> 00:13:51,560",visualizations to simple examples so I
322,"00:13:49,720 --> 00:13:53,759",used the classification data set the
323,"00:13:51,560 --> 00:13:55,480",spam data set I use this empty cars data
324,"00:13:53,759 --> 00:13:59,480",set for regression which we've also seen
325,"00:13:55,480 --> 00:14:01,880",before and then now varying mry as
326,"00:13:59,480 --> 00:14:07,680",percentage of total features in my data
327,"00:14:01,880 --> 00:14:10,240",set from 0 to 100 and I'm now plotting
328,"00:14:07,680 --> 00:14:12,000",the cross validated error of these
329,"00:14:10,240 --> 00:14:15,360",different mry settings and what you can
330,"00:14:12,000 --> 00:14:18,959",see is that if we set mry to very low
331,"00:14:15,360 --> 00:14:21,800",value to so maybe to one then this
332,"00:14:18,959 --> 00:14:24,600",doesn't work too well at least in in
333,"00:14:21,800 --> 00:14:26,759",this data set here so our trees are
334,"00:14:24,600 --> 00:14:29,320",becoming way too random yeah we are not
335,"00:14:26,759 --> 00:14:30,680",really finding uh good splits anymore in
336,"00:14:29,320 --> 00:14:34,680",our trees and then the variance
337,"00:14:30,680 --> 00:14:38,360",reduction also doesn't save us and then
338,"00:14:34,680 --> 00:14:41,680",M becomes a bit larger and that works
339,"00:14:38,360 --> 00:14:44,759",actually fairly well and at some point m
340,"00:14:41,680 --> 00:14:48,000",is too large yeah and this would here
341,"00:14:44,759 --> 00:14:50,000",for m equals 100% that would be the
342,"00:14:48,000 --> 00:14:52,560",original begging algorithm but you can
343,"00:14:50,000 --> 00:14:55,800",see that usually there's a spot where we
344,"00:14:52,560 --> 00:15:00,079",perform actually considerably better
345,"00:14:55,800 --> 00:15:02,480",than by just fixing mry to 100% And and
346,"00:15:00,079 --> 00:15:04,600",basically running the original bagging
347,"00:15:02,480 --> 00:15:07,279",algorithm so there is some Merit there
348,"00:15:04,600 --> 00:15:11,040",is some benefit in running this this
349,"00:15:07,279 --> 00:15:14,320",decorrelated version of The
350,"00:15:11,040 --> 00:15:16,759",Ensemble quite good default values exist
351,"00:15:14,320 --> 00:15:19,399",which have being empirically I would say
352,"00:15:16,759 --> 00:15:22,199",nicely validated so for classification
353,"00:15:19,399 --> 00:15:24,440",very often we set this m try here to
354,"00:15:22,199 --> 00:15:27,399",square root of number of features so
355,"00:15:24,440 --> 00:15:29,839",that's also due to Bron and for
