index,time_range,text,google_translate
115,"00:07:48,300 --> 00:07:51,331","But, isn't it more fun to think about these columns as the","Բայց, ավելի հաճելի չէ այս սյուների մասին մտածելը որպես"
116,"00:07:51,331 --> 00:07:54,568","transformed versions of your basis vectors, and to think about",վերափոխել ձեր հիմքի վեկտորների տարբերակները եւ մտածել դրա մասին
117,"00:07:54,568 --> 00:07:57,960",the result as the appropriate linear combination of those vectors?,"Արդյունքը, որպես այդ վեկտորների համապատասխան գծային համադրություն:"
118,"00:08:00,720 --> 00:08:03,780",Let's practice describing a few linear transformations with matrices.,Եկեք մարզվենք նկարագրելով մի քանի գծային վերափոխումներ `մատրիցներով:
119,"00:08:04,580 --> 00:08:09,358","For example, if we rotate all of space 90 degrees counterclockwise,","Օրինակ, եթե մենք պտտվում ենք ամբողջ տարածքը 90 աստիճանի հակառակ ուղղությամբ,"
120,"00:08:09,358 --> 00:08:12,240","then i-hat lands on the coordinates 0, 1.","Այնուհետեւ i-hat հողերը համակարգում են 0, 1:"
121,"00:08:13,980 --> 00:08:17,180","And j-hat lands on the coordinates negative 1, 0.","Եւ j-hat հողերը կոորդինատների վրա բացասական 1, 0:"
122,"00:08:17,980 --> 00:08:21,960","So the matrix we end up with has columns 0, 1, negative 1, 0.","Այսպիսով, Matrix- ը, որի հետ մենք ավարտվում ենք, ունի սյուներ 0, 1, բացասական 1, 0:"
123,"00:08:22,880 --> 00:08:26,630","To figure out what happens to any vector after a 90-degree rotation,","Պարզել, թե ինչ է տեղի ունենում 90 աստիճանի ռոտացիայից հետո ցանկացած վեկտորի հետ,"
124,"00:08:26,630 --> 00:08:29,620",you could just multiply its coordinates by this matrix.,Դուք պարզապես կարող եք բազմապատկել դրա կոորդինատները այս մատրիցով:
125,"00:08:31,560 --> 00:08:34,299","Here's a fun transformation with a special name, called a shear.","Ահա մի զվարճալի վերափոխում հատուկ անունով, որը կոչվում է կտրվածք:"
126,"00:08:35,000 --> 00:08:39,159","In it, i-hat remains fixed, so the first column of the matrix is 1, 0.","Դրանում ես, գլխարկը մնում է ֆիքսված, այնպես որ մատրիցայի առաջին սյունը 1, 0 է:"
127,"00:08:39,600 --> 00:08:42,481","But j-hat moves over to the coordinates 1, 1,","Բայց J-HAT- ը տեղափոխվում է 1, 1, 1, 1,"
128,"00:08:42,481 --> 00:08:45,300",which become the second column of the matrix.,որոնք դառնում են մատրիցայի երկրորդ սյունը:
129,"00:08:45,300 --> 00:08:49,962","And at the risk of being redundant here, figuring out how a shear transforms","Եւ այստեղ ավելորդ լինելու ռիսկի հետեւանքով պարզելով, թե ինչպես է կտրուկ վերափոխվում"
130,"00:08:49,962 --> 00:08:54,080",a given vector comes down to multiplying this matrix by that vector.,Այս վեկտորի կողմից այս մատրիցը բազմապատկելու համար տվյալ վեկտորը իջնում ​​է:
131,"00:08:55,760 --> 00:08:59,616","Let's say we want to go the other way around, starting with a matrix,","Եկեք ասենք, որ մենք ուզում ենք շրջել մյուս ճանապարհը, սկսած մատրիցից,"
132,"00:08:59,616 --> 00:09:04,520","say with columns 1, 2 and 3, 1, and we want to deduce what its transformation looks like.","Ասեք 1, 2 եւ 3, 1 սյուներով, եւ մենք ուզում ենք եզրակացնել, թե ինչպիսին է դրա վերափոխումը:"
133,"00:09:04,960 --> 00:09:07,440",Pause and take a moment to see if you can imagine it.,"Դադարեցրեք եւ մի պահ տեսնեք, արդյոք դուք կարող եք պատկերացնել այն:"
134,"00:09:08,420 --> 00:09:15,100","One way to do this is to first move i-hat to 1, 2, then move j-hat to 3, 1.","Դա անելու մեկ եղանակ է առաջին հերթին i-hat- ը տեղափոխել 1, 2, այնուհետեւ J-HAD- ը տեղափոխել 3, 1:"
135,"00:09:15,100 --> 00:09:17,605",Always moving the rest of space in such a way,Միշտ մնացած տարածքը նման ձեւով տեղափոխելով
136,"00:09:17,605 --> 00:09:20,220",that keeps gridlines parallel and evenly spaced.,որը պահում է gridlines զուգահեռ եւ հավասարաչափ տարածված:
137,"00:09:21,680 --> 00:09:26,228","If the vectors that i-hat and j-hat land on are linearly dependent, which,","Եթե ​​վեկտորները, որոնք i-hat and j-hat Land On On- ը, գծայինորեն կախված են, ինչը"
138,"00:09:26,228 --> 00:09:31,079","if you recall from last video, means that one is a scaled version of the other,","Եթե ​​հիշում եք վերջին տեսանյութից, նշանակում է, որ մեկը մյուսի մասշտաբային տարբերակն է,"
139,"00:09:31,079 --> 00:09:36,234",it means that the linear transformation squishes all of 2D space onto the line where,"Դա նշանակում է, որ գծային վերափոխումը ջախջախում է բոլոր 2D տարածքը այն գծի վրա, որտեղ"
140,"00:09:36,234 --> 00:09:41,328","those two vectors sit, also known as the one-dimensional span of those two linearly","Այդ երկու վեկտորները նստում են, ինչպես նաեւ հայտնի են որպես այդ երկու գծային միակողմանի տող"
141,"00:09:41,328 --> 00:09:42,420",dependent vectors.,Կախված վեկտորներ:
142,"00:09:44,420 --> 00:09:48,910","To sum up, linear transformations are a way to move around space such that",Ամփոփելու համար գծային վերափոխումները տեղ են տվել այդպիսի տարածության մեջ
143,"00:09:48,910 --> 00:09:53,940","gridlines remain parallel and evenly spaced, and such that the origin remains fixed.","Gridlines- ը մնում է զուգահեռ եւ հավասարաչափ տարածված, եւ այնպիսի ծագումը, որ ծագում է ֆիքսված:"
144,"00:09:54,540 --> 00:09:58,992","Delightfully, these transformations can be described using only a handful of numbers,","Ուրախալիորեն, այս վերափոխումները կարելի է նկարագրել օգտագործելով միայն մի բուռ թվեր,"
145,"00:09:58,992 --> 00:10:01,530",the coordinates of where each basis vector lands.,"այն կոորդինատները, որտեղ յուրաքանչյուր հիմքի վեկտորային հողեր:"
146,"00:10:02,760 --> 00:10:06,230","Matrices give us a language to describe these transformations,","Մատրիցսը մեզ լեզու է տալիս այս վերափոխումները նկարագրելու համար,"
147,"00:10:06,230 --> 00:10:08,820","where the columns represent those coordinates,","որտեղ սյուները ներկայացնում են այդ կոորդինատները,"
148,"00:10:08,820 --> 00:10:12,566",and matrix-vector multiplication is just a way to compute what that,"իսկ մատրիցա-վեկտորի բազմապատկումը պարզապես միջոց է այն բանի համար, որ դա է"
149,"00:10:12,566 --> 00:10:14,660",transformation does to a given vector.,Փոխակերպումը վերաբերում է տվյալ վեկտորի:
150,"00:10:15,360 --> 00:10:18,805","The important takeaway here is that every time you see a matrix,","Այստեղ կարեւոր Takeaway- ն այն է, որ ամեն անգամ մատրիցա տեսնելիս"
151,"00:10:18,805 --> 00:10:21,880",you can interpret it as a certain transformation of space.,Դուք կարող եք դա մեկնաբանել որպես տարածության որոշակի վերափոխում:
152,"00:10:22,580 --> 00:10:24,827","Once you really digest this idea, you're in a","Երբ իսկապես մարսես այս գաղափարը, դու ա"
153,"00:10:24,827 --> 00:10:27,320",great position to understand linear algebra deeply.,Հիանալի դիրքորոշում `գծային հանրահաշիվը խորը հասկանալու համար:
154,"00:10:27,660 --> 00:10:32,287","Almost all of the topics coming up, from matrix multiplication to determinants,","Գրեթե բոլոր թեմաները, որոնք գալիս են Matrix- ի բազմապատկում որոշիչներին,"
155,"00:10:32,287 --> 00:10:36,684","change of basis, eigenvalues, all of these will become easier to understand","Հիմքի փոփոխություն, eigenvalues, այս բոլորը ավելի հեշտ կդառնան հասկանալ"
156,"00:10:36,684 --> 00:10:40,560",once you start thinking about matrices as transformations of space.,"Երբ սկսեք մտածել մատրիցաների մասին, որպես տարածության վերափոխումներ:"
157,"00:10:41,300 --> 00:10:43,560","Most immediately, in the next video, I'll be talking about","Անմիջապես հետո, հաջորդ տեսանյութում ես կխոսեմ"
